positive,for new delhi seat arvind number sheila number gupta bjp number source website
neutral,ndtv figure differ from post official figure website put bjp aap cong and independent majority yet
positive,congress candidate chaudhari jee who have always win since number have lose this time
neutral,team become team and team become team lolz
negative,aap bjp pick these from diff twitter handle might not exact
positive,kejriwal trail new delhi
neutral,sheila dixit be here
neutral,shazia ilmi trail
positive,congress be basically open any secular formations laugh out loud get ready for aap congress coalition
negative,few bold predictions expect lot more social media promoters pay shill troll fight online just like the mao china social media promoter will become job description rahul will get more voice speak his mind the stupid balladeers will shut now but depend can salvage the party fail expect priyanka and damaadji stage neither happen inc may break bjp have momentum now unless they something stupid they be well set for next year expect tdp bsp didi amma consider alliance with mighty modi
positive,do quick check delhi nota numberth most result
positive,abhishek manu singhvi try defend the undefendable hahaha
positive,numberbjp numberaap numbercong this great
positive,every single msm walla who be pro congressi jump ship aap hahaha rajdeep sardesai look all set join aap the way all gush about aap
positive,sit china now damn proud abt our country that this thing about aap even possible our county be still the greatest and biggest democracy the world
positive,chattisgarh make happy damn chattisgarh be far more interest than other state
positive,seem kejriwal lead now here what bhaskar com have provide input this gist apparently fourth class employees lutyens delhi have support kejriwal they have connect themselves with the election sign aap broom some blah blah about aap protest and direct challenge sheila
positive,look like late the party happy that bjp cruise scorecard thank namo ssc and saab
positive,shila dixit do hawan special pooja her place think its too late for hawan
neutral,arvind kejriwal athirdee style
positive,could there really election the assembly hang
positive,only muslim cadidates win for khangress delhi
positive,great work arvind kejriwal the only way change the system become part take gut enter the political muck and make attempt clean kudos aap
neutral,bjp lead number vote from bawana constituency
negative,bjp will firm the goverment break congress party they have only seat
positive,bjp get first winner
neutral,shazia ilmi take the lead puram close margin htm
positive,prop website constituency wise result also available frequently update
negative,aap shazia ilmi from puram constituency lag behind aaps shazia ilmi lag behind from puram constituency number html
neutral,how come ndtv data
neutral,kejriwal lead with number vote over sheila
neutral,its cringe see congressis defend sheila and rahul
neutral,pic kejri watch result and smile
neutral,currently seat with margin below number aap ahead bjp and congress bjp candidate ahead shazia ilmi number vote from website
positive,time for some fun sanjay jha defend congress
neutral,how come election commission website hasn crash yet kudos
neutral,chattisgarh give headache
negative,delhi not sleep after long day see congress bite the dust don disappoint aap
neutral,remember arvind say join politics defeat folks like sheela and do
negative,with these result would have grudgingly accept that reelections be hold view hang assembly aap will surely come power
neutral,shazia lead puram
neutral,rajdeep sardesai and others please differentiate between lead and result the update lead not result
neutral,lead against sheela dixit
negative,shazia ilmi lose number vote
neutral,look the heatmap seem bjp have stronghold all the fringe areas delhi
positive,what most the people want bjp win and sheila loose kejiriwal todays morning look more beautiful
negative,sheila dixit lose whop margin number vote
positive,kapil sibal zero kapilsibal loss theory about this election zero win total loss hence zero loss prove laugh out loud
neutral,harshvardhan ahead number vote
negative,ask whether sheilad fail read the public mood she sarcastically say bewakoof hai hum
neutral,arvind kejriwal lead against sheila dixit
positive,bjp aap clear majority now
neutral,congress offer aap outside support but aap have reject
neutral,kejriwal the lead now
neutral,chhattisgarh spoilng the party
positive,just do quick check all seat with less than number difference bjp lead cong aap lead cong bjp lead aap aap lead bjp aap lead bsp bsp lead bjp cong lead bjp edit site bjp lead aap aap lead bjp bjp lead cong aap lead cong bjp lead bsp
positive,youngest mla aap candidate from deoli win age
positive,sikh journalist who throw shoe home minister chidambaram win
positive,aap candidate lead huge huge margin constituency the traditional stronghold bjp one thing clear aap the prefer choice many middle and upper middle class voters edit the local aap office here ecstatic and the broom be out amaze scenes try and take picture can promise phone cam really act weird
neutral,election
neutral,break news sheila dikshit resign delhi
neutral,shazia ilmi lose
neutral,bjp aap
positive,saurabh bharadwaj from greater kailash lead comfortably and aap have over number vote lead from seemapuri the constituency from where santosh koli be suppose fight from but be murder her brother fight from the same seat and lead big time
neutral,official result
positive,new delhi candidate party vote arvind kejriwal aam aadmi party number sheila dikshit indian national congress number vijender kumar bharatiya janata party number
negative,congress know they be have bad day when even barkha dutt take shit over them ndtv hahahah
positive,sheila dixit send her resignation fuck yes with that folks gonna hit bed thank mods sunny and rest awesome job aap thank volunteer and the folks who believe them all along for naysayers you guy way fuel fire for folks like congrats bjp hopefully this mark new begin politics good night
neutral,somewhere rahul see weep and sonia say power poisson
neutral,same with kapil sibal during lok sabha elections what happen shiela dixit
neutral,jayanti natrajan ndtv our political party not charitable organisation be not here serve the people be here win elections come into power such arrogance total what the fuck
neutral,alliance result lead change total bjp aap cong others await data from ndtv http ndtv com please vist them last update time sun dec number ist next update minutes
positive,new delhi arvind number sheila number here htm
positive,yogendra yadav the best spokesperson aap can find dude have all take patience subtle sarcasm and knowledge
neutral,eye burn
positive,best subreddit evar
neutral,bro you even css
neutral,why do you choose call army not something else this war
negative,you guy workout css what the fuck wrong there
neutral,that css
positive,leftist only true namo fan hey look everyone communal think
positive,well isn this open invitation for troll moreover you want really support namo then try influence those who be still sit fence and think congress aap
negative,strangely remind dumbledore army from harry potter
positive,good initiative mock these annoy people please add blue background red font color logo create use wordart under construction gif new gif auto play music rocky mittal banega narendar modi default font comic sans traffic meter
negative,do that mean you guy be leave india yay
neutral,yes now be go somewhere
neutral,tweet this thread
negative,what be the other policies you discuss not ask for detail you give above just bullet point thank you
positive,think would not understand policy discussions but what you have list simple good way summarize increase oil production guess that should easy since saw recently that leaders all party unanimously support this initiative for nominal amount really need this for inclusive development but guess this would need the support state governments too have really retard regional party rule promise state congress have totally fail this aspect hope bjp could turn things around definitely agree especially be way behind electronics market many semiconductor company have huge non manufacture sit here if i remember correctly intel be suppose usher semiconductor manufacture early number and they pull out because these lethargic policy makers not beat dead horse but wish bjp and all party become serious tackle the silent corruption government especially the regulatory and enforcement board like law and order environment water totally screw one family members high rank official one such board doesn matter which government have be transfer incessantly recently get transfer when get into tussle with opposition party mla industry and the rule party minister summon him next week and hand the transfer and top all not even honest do the least that could and that follow court order god bless the honest officer hope this would change maybe the political discourse that happen among people nowadays will change
positive,nice know that thank you
positive,its because bjp want such rule place and its better get do under congress they win get blame that way
negative,india have be ruin congress and populist scheme the problem with populist scheme that you can make noise you be opposition you instantly brand anti poor another problems once introduce not easy get rid them aap with share leftists and socialist like prashant bhushan yogendra yadav binayak sen and so on be more towards congress ideology with add agenda anti corruption compare bjp want see some pro market reform which will create job and get our country back growth rate another problem have the minority appeasement meet tauqueer raza and then go defend him aap do the same things that congress do third holier than thou attitude they just don accept that there be good non corrupt people all party lot people from congress and bjp join aap and suddenly become non corrupt while they be corrupt their old party don hate aap don like their ideology and attitude would even vote there be option aap like party with right lean economic ideology as far as i know loksatta one such party but even though stay hyd don have vote here have vote native state
positive,long rant from aap supporter answer for all your question you think that aap the only honest party and arvind some kind messiah arvind say that gadkari corrrupt that you will start run around with pitchfork and torch but ignore the news when gadkari prove innocent arvind say that bjp congress you aaptards be intellectually lazy will just accept gospel truth without ask why be raman singh jaitley shivraj vasundhra modi goa corrupt infact they be some the most honest intelligent and progress drive politicians india since very long time unlike aap bjp actually take action against part members who act retard case point jethmalani jaswant reddy kesubhai and many others compare that aap one found members bhushan hardcore anti nationalist shazia catch accept bribe even before election action against them defectors be give ticket arvind himself play mulla appease policies numerous time aap just bunch idealist lefties who keep shout the loudest that all politicians be thieve people be stupid accept the generalise statement and convert aaptards without check the truth still don necessarily hate aap just think that bjp much better option also that most aap fanbois be just fanbois who can think thing themselves add later also point about aap fan be retard prove the downvote campaign which the resident aaptards downvote all comment after every such post prove point that aaptards be just bunch intellectually empty fanbois even the seem naive with his silly question
neutral,every question yours load how you expect objective discussion
negative,because aapturds eat poop then they poop and they use write false promise that why they be call aapturds
neutral,do you adopt the karl rove strategy make question that will give the responses you want park and recreation reference for those try figure out for the record don support any the party mention here for indian politics have come choose between the lesser evils
positive,politics part the unholy duo religion politics which bring out some the most emotional and impassioned read hold bar slug flamewars the web expect people argue beyond region and logic
positive,have say time and again most people arent shallow mind like the aaptards think vote single agendas agendas which they know unrealistic and just be plain rhetoric dont blame for not have the tunnel vision that you lot be afflict with corruption do not mean effective governance rather live corrupt nation but one that provide relatively better governance than honest state that just stagnate you didnt understand what say the previous para that exactly the problem with aaptards and you need expand your political perspective
positive,aap the new congress congress issue certificate secularism aap issue honesty anybody who come from any party and join congress become insta secular similarly all the odd mlas who go from bjp cong aap because they be reject their own party have become insta honest way just like cong the gangotri indian secularism aap the yamnotri honesty
positive,thank for prove once again that aap supporters be bunch immature bholas have deep root casteist and communal view this why easy for congress make fool out you they split their opposition vote and make delhi ungovernable and you stupids fell for their game plan and still haven wisened hahahaha elong troll
positive,problem with aap they be like worker union leaders sure they have honest intentions but then again not sure good union leaders would make good mds maybe wrong here but how much will ways aap survive reality still unknown even maharashtra prithviraj chavan be almost force resign when expose ajit pawars corruption even helpless what can you expect from others corruption like vicious network intertwine and ingrain into indian society should focus change society unlike aap dudes who think bring some law go improve things practically speak bjp right choice about aap nothing can say how can perform national level
neutral,all those who wonder why would prefer bjp over aap for them just for starters these policies link here
negative,suspicious all politicians but simply cannot trust and accept anyone that have problems hold democracy hostage both and that hazare hack be guilty
positive,thank lot for the insight can easily relate point for example be never interest know something like katch but with superb promotion the gujrat tourism have certainly catch family attention and now feature the visit locations for any idea how they would tackle the population increase problem india since may root cause many issue poverty level inflation essential commodity deplete form land
positive,don know what kind post you be read rindia there be many many aap supporters here many post aap supporters even mod aap supporter
positive,good that have already start his policy hope get one chance the top job about years yes policy decisions take time bear fruit upanumber actually enjoy the benefit policies nda look upanumber see how they actually perform
positive,india also need test the new nuke design hope that pokhran get test some newer and lighter mirv design for our new missiles soon
positive,great appreciate your efforts and this healthy way debate and criticise opponents not the kind which involve baseless lie rumor and team foreign fund crap tire those now which for some reason bjp followers think more effectice don know who tell them that because only piss off and more damage than good bjp itself and since you mention your post and make clear our discussion that corruption the issue for will track this post and engage ina discussion once you address that point because matter what good policy you come with unless you can implement the grind they mean nothing and this why before anything want corruption address share with how modi plan fight corruption
negative,hate aap for the other thread point such the routine flip plop appeasement ology position state about batla house and so on this particularly because aap proclaim basic that others be not sum aap self advertise image and platform their commentary why they have not yet perform nothing about
neutral,this will restrict migration this will definitely strike chord with mumbaikars hope they articulate this well the upcoming rally
positive,not bjp supporter but love how modi core internet savvy supporters who claim modern be come term with the fact that their leader the only one who do not make any statement about number
positive,royaltreat you should ask your friend whether modi intend revive vajpayee river link project that one have huge potential boost agriculture and solve many our water issue
neutral,will the party support his vision
negative,perhaps they fear they may lose small fraction voter base they either support oppose hopefully they will come with their view soon what think the problem that many individual party members may have personal opinion but they don want say anything against the party line this just personal view party traditionally with right center view and the fact that they be mum about the supreme court have revert the decision make the delhi high court fear they agree with but hope they take stance soon not have opinion all the worst stance for any political party especially issue relate human right number homosexuality any other especially when party have strong candidate run for
negative,critical issue nice priorities bro for the record fully endorse the repeal the archaic law which needlessly protrude into the bedrooms consent adults but dont get carry away except tiny tiny minority urban center one give shit this issue
positive,the only problem will take years show its effect society grow great when old men plant tree whose shade they know they shall never sit the fact that the bjp manifesto which honestly could just bunch populist bullshit promote long range initiatives reason itself optimistic about bjp lead future years isn that long reality but the mind indian politician parliament election cycle
negative,really have very little issue with bjp economic policies think they have the clearest agenda among big party more concern with the social aspects their agenda they also be do terrible job the opposition and be know pretty corrupt
positive,like bjp should put this their manifestos anyway least the middle class and the business community will find attractive please continue you have more one suggestion read trade magazine some time ago about how employees maruti factory be strike for wag the tune whop lakh illustrate how our labor laws have drive salaries unsustainably high many manufacture sectors and stymie india efforts become manufacture hub how even bangladesh be have more success than this regard fact this why many indian manufacturers seem hire disproportionately high percentage contract labourers work their factories they don have pay them the same high rat from this would say labor reform and reduce the power unions something else that need consider the hide policies that be wait
positive,really hope focus more rooftop solar ece like germany not just gujarat but the entire country much good skip hydrocarbon and straightaway adopt renewables that will have adopt anyways the future
neutral,well who actually read the manifesto
positive,why should bjp say anything there law have amend scrap the government can introduce the new law parliament and depend the new law bjp can choose support not the problem post the other thread day back most people be misunderstand that the article number against homosexuals cover wide range issue and the foundation for other laws also make lot heterosexual act unlawful include general term blowjob and anal sex you read and understand the entirety the law then you will understand that doesn mention homosexuals and apply against them should the law scrap sure but before that see that since this the only law that cover sodomy guess india will also need laws cover rape male female another male also not sure the new rape laws number protect male child not coz they not then this the only law per understand which can use punish the criminal law not against homosexuals apply against them can apply against heterosexuals also scrap but create new laws first replace this law someone from the legal fraternity can ama and answer our question about article number and rape abuse laws india will great clear the misinformation
negative,politically would stupid move take stand right before the elections maybe that the reason
negative,would like bjp come out support scrap sec number but win expect them make comment this because there be lot religious organizations which be against scrap number and support bjp there might loss support bjp take stance this close national elections might not work well bjp do not have presence many state would not like alienate whatever support have other part meenakshi lekhi point out her tweet this rule doesn make any difference the act between consent adults neither them will file fir police win come check around your bedroom see what you be upto just that will illegal act eye law congress the other hand have come support scrap this law openly this spite asg argue for the law guess congress know win form the next government any stand take issue win hurt them much
negative,the government should have say what go between two consent adults room period why the hell be you bother about his stance lgbt right just because that moron sanjay jha raise the issue
negative,politics number country that medieval mind the one hand and seek numberst century capitalistic interest the other
positive,let put forward some problems and issue the first problem solve define sodomy and what act be include presently blowjobs anal sex and so on be illegal for everyone the major question arise whether allow fuck the assholes yes then should allow just between homosexual interactions among heterosexual ones well lesbians have sex fine until they be not really penetrate anything you would wonder then how could call sex but they wish use sex toy for the same they be not allow own sell produce sex toy ban india sex toy be allow india again the question arise should allow just between homosexual interactions among heterosexual ones well even the act sex need define the present definition wont stand the point do not affect single law affect plenty laws comment the issue would mean lot things and believe unless someone have clear idea what other effect that might have the exist laws she should refrain from comment its good support oppose something but do without knowledge inappropriate
positive,critical issue laugh out loud one care
negative,this would issue these people be prosecute under number and throw jail tbn andnumbergctljwbsdyreogwxjxqaeakwn eauxrnumberfnnumberylsdimxltrmsinumberlh jpg jpg pridenumber jpg agree that the article joke which also criminalize heterosexual oral anal sex however practice person only charge one the individual not adult the act commit without consent yeah archaic law that need but doesn harm anybody hence political party stance the issue irrelevant
positive,good the focus create platforms for wealth creation rather than distribute doles also more free the economy more less the corruption will hope bjp stay that way and do not bow the pressure the leftism atmosphere this country
positive,dazzle your profound understand contemporary indian politics bend down respect and touch feet
negative,think there be more important issue hand than one stupid law that hardly enforce
negative,you sincerely believe that anyone who doesn identify with your political beliefs ignorant and corrupt you be moron you accuse all non aap supporters be corrupt different from bjp guy claim that anybody who doesn support them anti india
negative,be you corrupt mind have you benefit through corruption sadly you blindly support some other party support another party not blindly you support some party because your caste religion brahmins bjp and muslims congress nope you don believe corruption can eradicate indian politics yes corruption cant eradicate from indian politics downvote for be realist
negative,the high handedness presumption assume be you corrupt mind even without listen opponents argument common pattern may necessary condition all aaptards can live with corruption but can stay put with the guy who act holier than thou
negative,be you corrupt mind please sir what do that mean
negative,think this hate sort specially spread few users who be staunch supporters bjp the reason for this hate part those users understandable they fear modi chance be the down because aap you play close attention you can see through their double standards and bias for instance few weeks ago one very active supporter bjp be see say kejriwal power hungry and look how betray anna and these days you would see that user say kejriwal scar accept the power and form the government personally don believe bjp will bring utopia they win number narendra modi have do great work gujarat and have immense appreciation for him but not trust rest the leaders bjp come from bjp rule state can tell you that the grind reality far from what they show the news break roads mis governance and massive corruption every level the other hand aap have overstretch their promise because lack experience aap far from be stable and smart party which can provide good governance haters gonna hate don fool few users who try spread negative propaganda
neutral,don want arvind
positive,because those sanctimonious rascals want promote hindu muslim unity wait till modi come power rightofcenterhindu say godhra be just trailer there be many more babri masjids this country
