positive,fox news last night be say the plan engines run out fuel different point which make the plane spiral into the water and therefore make huge crash and consequent debris field the whole spin out control because engine rotational force be adressed like thread
neutral,local paper report number object capture satellite always grain salt
neutral,give the prevail currents this region the world wonder when stuff will begin wash tasmania west coast
neutral,number object locate
negative,what could have cause that final partial ping why do this mystery keep riddle itself
positive,still think be deadhead and wager they have lax security when come other crew fly free have they release the manifest yet
positive,guy malaysian here apparently there be talk about sue boeing and mas just make sad because sincerely believe that our gov do the best they can sure people say be corrupt and bite lazy but know for fact that time like this will our best and give everything have know our leaders and can see how tire this for them be they really do that bad job just the media put controversial headline stir things what you guy think sincerely want know what fellow redditors think about this
positive,how why under what circumstance can the families sue the airline follow this story understand that be maybe not handle the greatest way airline execs representatives understand that the families will should receive money for the loss expense what have you but for what reason would they sue the airline and would they definitely win this honest question just feel though when you buy plane ticket you get board know there possibility your plane can crash something can happen ect
positive,for those interest the ghost plane scenario happen ghost flight case study html
neutral,the number potential object hpt
negative,post statistics for other academic math junkies try wrap their head around this mystery
neutral,video show mhnumber flight simulate pilot australia only boeing number simulator
neutral,today press statement photos have be post php story fbid number number refid
positive,still don understand how the burst frequency offset analysis rule out the northern corridor completely take mirror image whatever flight path the plane take with the axis symmetry be line from the plane origin the satellite that mirror image path would generate the exact same return the analysis understand that the satellite be also slightly bear south due slightly eccentric orbit but wouldn the above still hold where there be exactly two possible paths that be mirror image each other that would produce the same return only that the mirror image path would need adjust for the eccentricity anyone care enlighten
neutral,wonder there be any way for passenger crew member leave some sort message about what happen either phone laptop physical one that could actually recover
positive,regard that dead whale do anyone find out how die be hit great big airliner fall out the sky
positive,solid work ethic throughout the entire tragedy gratitude can not express how much greatly appreciate the hard work
neutral,why they come with this now ministry rmaf think mhnumber order turn back number html
positive,quick poll the poll now close tell you be quick poll many thank indeed all who take part what you reckon happen mention comment below explain why you feel that way you desire and add the poll result let know any more options should add note that this poll do not show that there more evidence for any one scenario over another there currently not enough evidence say that any particular scenario the most probable pilot suicide hijack fail hijack mechanical failure fire paranormal black hole alien government conspiracy other hybrid honestly idea
positive,numberam thursday perth hope the weather permit them safely search today wonderful see many governments work together find the wreckage specifically australia
negative,thank you for your work cover this be come here instead mainstream media because want good update and facts oppose sob stories not that isn tragic but hate that media take advantage the emotional vulnerable you give facts and source and put into readable format thank you again
positive,very detail map for quick reference pinpoint geographic timeline map numberth numberth march latest map web svg detail route possibilities and project final position with satelitte arc way point and current serach field grids current numberth march cumulative amsa search area map pdf these be recently post another thread but be some the best have see
neutral,amazon crack this morning
positive,have be read these thread for over week now finally some discussion about satellite make join let assume they have some satellite picture days back and realize this days back would they not able slow fast forward the remain days over the next days and get date location now why that day they talk about picture from day then day they talk about picture from day and realize that earth big and satellite not take picture all spot all the time but seem like the satellite be take just picture per day then during this one day the debris have move number they and hunt for those picture amongst their million picture that take day and would also think they should able relocate their satellite specific area and track the ocean better but that too seem miss miss something
neutral,have they ever once find the object indicate satellite be roller coast emotion with these satellite spot object and debris yet when they out there they find nothing even isn plane debris must something
negative,amsa news update ship stay search area will attempt continue search but all plan return bad weather expect for next hours
negative,be surf reddit for months without account after three weeks this thread finally force myself make account just thank you for all your hard work and dedication
negative,amsa news today search operations have be suspend due bad weather all plan be return perth ship be leave search area
positive,many debris report and none them confirm from the plane
neutral,do everyone have satellite didn realize that thailand launch one
negative,search effort have now swing towards locate the black box search effort swing towards find black box
negative,excuse this be already ask and answer but know the satcom from the flight ping from any other locations during the initial flight path other than the ones inmersat pick not then why only ping this satellite
positive,how much the search area can scan the pinger locator before the flight recorder battery run out and how far away can and still detect the ping
negative,any idea what be the weather like the southern indian ocean along the current search area and probable flight path numberth march see bad weather and call off search last days make suspect weather also be not very hospitable the fateful day also would right assume that this probable flight path be far from any flight rout airliners and ship
negative,there way outside the cockpit for the crew communicate outside simply send distress signal sorry this have be ask
neutral,video what condition can like the southern indian ocean w elong youtube com watch jupnumbernajpnumbermi
negative,here interest tidbit what the like off perth have give the crew lot respect after read this be very reliant lookouts who use binoculars and night vision devices scan the horizon and scan the area around our ship very cold rotate the lookouts through every hour hmas success and other ship remain search for any debris from the miss plane despite bad weather force all plan postpone the hunt for debris w elong news com travel travel update thai satellite spot number object possibly part miss malaysia airlines flight mhnumber story fnizunumberq number
neutral,what do everyone think the seal evidence that malaysia cannot will not release the public
neutral,steven mark atty pro lawsuits against plane makers for families be just allow state fact with counter argument cnn that the number silkair crash be accident rudder issue be find court the ntsb computer model find deliberate act the cockpit probably pilot suicide but that evidence be not allow present the jury even years later confusion and contradiction reign because everyone have different dog these fight
positive,this may bite off topic but go trivia night bar last night and two different group people have some riff joke about mhnumber their team name one be where waldo mhnumber edition and the other be something else stupid think be incredibly insensitive consider talk about the death nearly number people here
negative,the live owe respect the dead owe only the truth voltaire would add that owe the truth the live well however painful how learn
negative,be follow these thread from the begin and haven see the answer this apologize this have be ask and answer already what will learn when recover the black box what sort information will record and how can use determine what happen
neutral,checkout this backdoor
positive,post yesterday about use bay theorem inform the search for mhnumber and get some really useful comment be think about the statistics this case lot recently could someone help confirm refute the follow logic let assume that with such vast sar effort couple with what emerge shortage satellite imagery from various source that the probability find mhnumber debris any give day the sar effort that pass the smell test the sar effort have go the correct location for say days earnest wouldn that imply the probability find debris that period time and increase the days the search have be go include the continual sit image review go behind the scenes the probability find confirm debris those days would something just doesn feel right about the fact that they haven find anything yet let have mature discussion about this edit just think experiment what give the sar crew the benefit the doubt and say the per day independent probability find wreckage and let assume this thing go for another days with verify lead debris that case something would really fishy chance should have find that hypothetical scenario edit make this sensitivity table help visualize the effect change the input parameters
negative,computer model from the university western australia show how debris from miss malaysia airlines flight mhnumber might have spread across the ocean surface malaysia plane new debris satellite
positive,do anyone have any update potential fire suppression bottle that wash maldives call from the unknown cell phone burner captain when can expect the flight sim delete data recover know the track buoy be track with the new satellite image thank advance edit add question
negative,prepare for downvotes but after watch several documentaries twa flight number today not sure can trust our government with aviation accidents the head guy the ntsb currently be the jackass who be change zone tag the twa number investigation hangar regardless be glue this story since day and still boggle mind that they have physical evidence
negative,thailand say satellite image show number float object the hunt for wreckage search crew race beat bad weather number html edit pics here satellite find number float object search miss malaysia airlines
neutral,pilot son speak out fnizunumberq number malaysia airlines cancel their press conference today detail why
negative,look through today thread comment and didn see this post here yet sorry already have be believe they know where mhnumber crash html
positive,apologize advance for ignorance but why keep see satellite image that be days old be they not able look more recent image just the sheer number image they have comb through that the time they find something the image be already few days old
negative,nytimes report that pilot look like dead end the flight simulator and hard drive that the pilot flight number have their home appear dead end yield few clue that shed any light whether they deliberately divert the miss jet accord two people brief the investigation malaysia airlines flight number html
negative,don forget vote this thread there lot work go keep correctly and conveniently inform for the past days
neutral,have anyone here say anything about this yet saw over worldnews malaysia say there seal evidence mhnumber that cannot make public say theres seal evidence mhnumber cannot make publ
neutral,have ship actually pick any the float object be see the satellite
neutral,tomorrow somebody will find number float object
neutral,thai satellite have reportedly pick around number items float water around number from perth they be numberkm from the location the french object which be photograph day earlier likely different aspx
positive,press statement ministry transport malaysia thursday march number numberpm chinese special envoy yesterday his excellency zhang yesui the chinese vice minister foreign affairs and special envoy the government china meet with the prime minister and dato seri hishammuddin the act minister transport and the minister defence follow the meet with dato seri hishammuddin his excellency zhang yesui also receive comprehensive technical brief the international work group lead the aaib inmarsat find which lead the conclusion that mhnumber end the southern indian ocean be explain during the meet the civil aviation administration china caac and the aircraft accident investigation department aaid the caac be present yesterday technical brief the caac and aaid have be and will continue members the international work group today his excellency zhang yesui also meet with the chinese relatives those board mhnumber who be currently malaysia commit work closely with the government china and share all information relate mhnumber full family brief beijing yesterday the malaysian high level team meet with the chinese relatives those board mhnumber who be base beijing for the fourth time over the duration the three hour meet the relatives receive technical brief and update the search operation the high level team also answer question today the high level team meet relatives again numberpm malaysia time the meet still underway malaysia work hard try and make the brief the chinese relatives beijing more productive malaysian officials meet with his excellency huang huikang china ambassador malaysia request the government china engage and clarify the actual situation the affect families particular and the chinese public general operational update the plan area search today be number square nautical miles the west sector and number square nautical miles the east sector the area identify the malaysian remote sense agency mrsa yesterday where the number potential object be sight be also due search today today nine plan travel the search area five the east sector and four the west sector the east sector search air be conduct two australian civilian aircraft one chinese ilyushin one new zealand civil aircraft one japanese gulfstream the west sector search air be conduct two australian orions two australian civil aircraft today six ship be deploy the search area one the east sector and five the west sector the east sector search ship be conduct one chinese ship the xue long the west sector search ship be conduct four chinese ship the kunlunshan haikou qiandaohui and zhonghaishaohua one australian ship the hmas success one chinese ship the hai xun expect arrive the search area tonight today the weather deteriorate the search area and search operations be suspend numberam malaysian team go perth malaysia the process send team comprise the dca mas the royal malaysian navy and the royal malaysian air force perth this team will work closely with the australian rescue ordination centre assist with the search operation direct link facebook php story fbid number number
neutral,atsb summary today amsa and atsb media conference malaysia airlines flight operation for malaysia airlines aircraft aspx uzubshynrri twitter media release search operation for malaysia airlines flight mhnumber operation for malaysia airlines aircraft aspx uzubshynrri twitter
positive,what be the odds all this debris that have be spot not from the plane since they be shift the search number miles can debris travel that far days
positive,basically receive report satellite image show debris the southern indian ocean but one have actually put their hand any must less confirm what any the debris
neutral,press conference tomorrow numberth will hishamuddin attendance the crush continue
neutral,chinese online travel agencies ban malaysia airlines ticket sales online travel agencies ban malaysia airlines ticket sales
positive,new search area pdf pdf look like right top the diamantina trench
positive,the new search area very close diamantina deep consider how quickly the entire search force abandon the previous location and that fact that the fbi be set have complete their analysis the captain hard drive they find diamantina deep his internet search history would both the kind credible evidence that cause complete shift search area but also something you absolutely could not release the public until confirm with wreckage thoughts
positive,do this debunk any ghost plane theories plane can make turn after new coords be input but never hear one automatically speed
positive,amsa and the atsb will hold press conference number aedt provide more detail the new search area do anyone know where this press conference might find online google skills be apparently lack today
positive,amsa press conference live now
positive,here good graphic which have way verify not sure already be post not haven see before show overlay australia radar coverage and the last ping derive arc location the plane the arc go straight through the satellite system which think already know before someone highly motivate and with inordinate amount free time could and stick there the various search areas and debris sight that would super cool australia refuse confirm deny whether the plane be detect well accord the trustworthy media but think either their system be down malfunction and they don want anyone know they do detect the airspace and be use that direct the search areas and be keep secret for who know why and need the doppler effect only cause cool either way can imagine that they do detect but be refuse use the info release other investigative agencies they spend boatloads money search for this plane too and doesn make sense for them continue spend what they know incorrect also the plane be detect why would they keep that secret not like their satellite capabilities be secret don think this case the plane fly under the radar think this radar go pretty low would have waste enormous amount fuel and the ping probably would have cut off lot sooner think there good chance the plane pass through this region and wasn detect for whatever reason jpg
positive,question possible the plane be program just before number fly that way until run out gas and everybody board be dead
positive,think easier hide plane for weeks than crash one and try find especially with countries and shitload satellite numberhr prowl with the whole world demand answer
negative,update still find debris black box evidence the pilot remain standstill
positive,aircraft arrive new search area and have not find anything that would classify debris australian official say html
positive,live give update search watch
neutral,image from thai satellite image be capture thaichote march number number around with numberkm width the location around number from perth coast this location number south france satellite image
neutral,mas ceo will give press conference numberpm myt
negative,the elephant the room that more than likely none the debris that the satellite pick be wreckage from mhnumber remember either hear the news read article about how ocean currents that part the world often bring together all the stuff ocean have collect over the years bystander and already felt hopeless and frustrate can only imagine how the families and search rescue team feel
positive,the new analysis that the plane fly faster burn more fuel and travel less distance these factor would lead less flight time but time air the most concrete fact the ping data confirm these point faster burn more fuel and travel less distance work with the fact the plane must also the air for hours
negative,confuse they be say the plane be travel faster than they think more fuel be be use travel shorter distance but they have ping all the way assume the plane have not yet crash until least that moment which would have stop the ping there concrete amount time have the air how could travel less distance when be travel faster for the same amount time be they say that they overestimate whatever time after the plane be the air which would have have less than hour and that compensate for the decrease distance
positive,consider that the current search area take hours get hours search and hours return for the hours fly time think everyone should thank their lucky star that the new search area turn out number miles the northeast the current search area toward australia turn out number miles the opposite way the plan would have have nearly zero time the target search area before they have turn back fuel
positive,look into the live malaysia airlines flight number pilot lmyqjaxmtanumbermdiwodeyndgywj far they have turn nothing unusual the pilot
positive,give this new search area would that put the plane place where australian military should have pick
neutral,there part
neutral,feel this have today be ever go find aircraft ship come on elong
positive,just when you think they finally have solid search location another change another place be days like that that completely incredible three full weeks with sign not single piece that plane not blame everyone just clarify know this have be unprecedented just find hard assimilate that have be this long
positive,the search area for miss malaysia airlines flight mhnumber have be update after new credible lead be provide the australian maritime safety authority amsa result today search will shift area number kilometres the north east base update advice provide the international investigation team malaysia the new search area approximately number number square kilometres and around number kilometres west perth more here pdf
positive,boys shit go fly this plane isn the indian ocean
positive,cnn confirm email alert the search for flight number wreckage have shift number miles the northeast base new credible lead say the australian maritime safety authority
positive,someone previous thread put new pics the sphere that wash maldives phone can credit but look like the fire suppression bottle word from number but could that link the search area shift edit thank conradaiken
