negative,remember when vajpayee address conference hindi those who say should just use english the leaders countries like china russia japan and so on generally use their native language with interpreters when speak foreign leaders audiences why can our the same
positive,this news doesn know english anyway edit course do have certain level english proficiency like any chaiwallah thug any indian city point not manmohan singh not half him not thousandth him
positive,kind pointless but make difference really english the language international business
neutral,bitchies
positive,modi like what you do there keep real
positive,aw elong yeeeaaaah elong this awesome
negative,that blatant stupidity rather than something proud
positive,great now will have even more backward ass reputation thank these north indian leaders
neutral,should choose tamizh and respect the sentiments the tamizh people
positive,fuck yeah the not know english sham and people feel elitist because they speak particular language need stop and glad modi not succumb not after that karan thapar interview anyway
positive,should use the language most proficient its hindi gujarati
positive,will proud moment for all indians when deliver his address hindi this september
positive,first think this some rajnath singh anti english joingoistic drama but after read comment feel satisfy and believe should ahead with hindi only
positive,good initiative however hear him take the oath and find that his hindi have strong gujarati influence perhaps could take some lessons improve his diction for all people criticise modi would like know their stance hollande speak french merkel speak german while address international press conference
negative,ugh typical bjp imposition hindi their predecessors bjs be hindi zealots this big fuck you regions india that not speak hindi fuck north indian cultural imperialism
negative,all over educate lefties who travel around with air authority must have seizures
negative,let him speak man language choice not good enough representation any man
neutral,but still use english twitter
positive,honestly don see the issue here more comfortable speak hindi decide converse hindi from here modi orator english where close modi orator hindi
neutral,still not recover from the karan thapar disaster guess
negative,what do this mean for potential modi ama will allow speak hindi
positive,why this such hot topic debate modi more comfortable hindi gujarati then have every right use should merkel always use german and putin always use russian and so on why should modi use english
positive,thats good have very strong command the hindi language hear some our politicians speak english make cringe because their poor grasp cause the impact their message lose let the translators their job
positive,ammal be director kalaignar fulfill legal requirements the company and she do not know any language except tamil her counsel tell the court addition shanmugasundaram say she can recognise anybody except close relatives and that she years old and need medical attention health ground win oppose the bail application move dayalu ammal say the public prosecutor lalit however oppose the bail pleas all the other nine people accuse the money launder case include raja and kanimozhi dmk rajya sabha and minority shareholder kalaignar
negative,not oppose bail not the same drop investigations everyone but the most dangerous criminals be entitle bail dayalu ammal not active politician business woman she just someone prop director meet govt requirements this very common thing all company since until last year you need directors shareholders for private limit company you want start business and do all the hard work for why would you want give away share stranger you just get your wife mother daughter and so on some other family member you trust will not act against you the other shareholder directory make more sense for woman because they get better tax break and also the misogynistic reason that they be under someone control wah modi modi run the executive branch the government the judiciary court be not and will never under his control the court grant bail not even the govt prosecutor agree the bail the judge can refuse and the judge can deny bail even the govt prosecutor demand otherwise
positive,think this because many the accusations make earlier have evidence back result wild imagination fuel prospect gain political capital malign the opponent secondly there another issue that often these allegedly corrupt guy hide their track well
positive,maybe because aap lok sabha candidate from hisar yudhvir singh khayalia give him clean chit
neutral,modi fix the bureaucracy maybe do not need the distraction yet
positive,that handicap prof deserve every bite legal hurt that come his way for the things accuse do colour not bother
positive,do you not get the part where say she years old and need medical attention
positive,party don act the law do give them their due process the party government should speed yes but there some more important shit atm
negative,because they that vadra the congress will the same them when they come into power and you have retard believe the congress win come back power eventually there implicit agreement between political party that because every politician have some skeletons his closet the degree vary but every politician corrupt the very nature the game attract certain kind player they bite vadra right now the congress will come back bite them
positive,karunanithi wife severely suffer from some brain relate disease she have some memory loss and hence her prosecutor appeal the court acquit her the case hate dmk but this fair she genuinely suffer but kanimozhi karuna daughter and raza be be undergo trial cbi special court
neutral,launch investigation into vadra land deal number html
positive,they have already say the law will take its own course and there will personal vendetta against anynumber and the investigation already underway rajasthan
positive,there personal vendetta and the law take its course the more they talk about know media will say vendetta over development and the true face and colour be show and all that nonsense what not personal vendetta be quite rightly election issue have idea why you confuse these two people india have remind about damaad shri especially the time elections and that what bjp do look like you want namo not allow the law take its own course and make this priority then modi above the law headline wait which will follow the evil dictator reference see enough will the right thing your efforts equate nda with upa downright silly
negative,would say that congress have use the cbi create incriminate file all opposition members probably same with bjp the same way how and bsp hate each other yet have do nothing against each other when they come power
positive,suppose bjp start act against them what you think will happen let give you the idea everyday there will news how bjp leaders be more corrupt and with full proof evidence which might put bjp lot more trouble
negative,may soon the mandate be out let all expectations investigations coalgate cwg they have make video vadra but they cannot even file fir and guess what the gas price be very likely the same shit chaddi gang chide kejriwal for actually go happen cms
neutral,commies rindia unite
positive,people who live glass house shouldn throw stone
neutral,tacit understand among political party
positive,india federal structure modi will have work with several congress and their cronies like cms several people like shourie have repeatedly say that must take them the cms partner otherwise his development efforts will not bear fruit the cms will simply put their foot down and refuse operate subsequently the centre may start harass them which will further ensure deadlock what you imagine will happen congress rule state modi go after vadra gun blaze cannot your face confrontation will the rajmata allow cms give red carpet welcome modi brazenly go after her family have lot more subtle consider the control she have the party someone have already give news link the launch investigations rajasthan govt this cannot aap fantasise tamasha real world do not operate black and white
negative,bjp win touch vadra vadra didn about his land acquisition spree himself you need others play their part too the reason why bjp win investigate and out corruption congress they congress will out the corrupt amongst the bjp yes bjp and congress be the same side the dirty coin and they will hold each other ransom use bjp fanboys will never admit that
positive,why pick just this there be many issue deal with go take time
negative,what do you expect them put every corrupt person jail the day they be swear be you naive
neutral,because the bjp not the court
negative,indianbureaucrat pakka leftist defend prof arrest for naxal link cant even believe him
neutral,read niticentral the daily pioneer know whats happen national herald case already start
negative,same shit new avtaar abki baar modi sarkar you sir just copy line context anyway
positive,look how happy they look together jpg
negative,too cynical think that the political class will not after one their own when party power will cry hoarse about member be corrupt criminal and so on when come power they keep mum about and vice versa as far as i know be only tamil nadu that this pattern be break jayalalitha and karunadhi go after each other when they be each power
neutral,remember sheila dixit and number page proof
positive,be just one comment uma bharati during campaign bjp clearly say there will witch hunt and law will take its course modi not kejriwal make career out witch hunt
neutral,
neutral,itt all congress and aap supporters unite and scream cheater cheater
neutral,what about coalgate
positive,first all gandhis be really really powerful even though they be not power they have people all over administration any direct attack gandhis will have have dire consequences even kejriwal rarely take name rahul and sonia gandhi for those you who dont know bjp more corrupt than congress congress know its way around the system most their deal doesn leave any trace money factor for govt make money give free hand gunda elements and they want fix return per week city its thats why gunda friendly congress follow the official route just reverse thats why govt sop bjp doesnt have luxury use this route they directly deal with corporates thats why business friendly aap not even equation national let them prove themselves then should compare with bjp congi why govt silent vadra party power have act responsibly not say they will ever will but even they act against gandhis vadra they have really sure about themselves nobody vote for modi take revenge gandhis even they fulfil promise mere yaar agli baar bhi modi sarkaar rajkumar voice hum who hai number modi wait kar rahe hai jani
positive,wait wait weren people all against aap yesterday for spew venom against gadkari without evidence isn this the same thing wait course not the bjp can never wrong
negative,can walk the talk remove astrology course universities that be introduce the previous bjp government
negative,wow this be the main reason ysrcp get least seat otherwise they would be reduce seat
negative,yes please and please start ban these astrology program first they be fuck everywhere
neutral,how about start find the killers narendra dabholkar
negative,isn hinduism islam and so on equivalent blind faith
positive,good make religion illegal and then its
neutral,hindus need move beyond brahmanism and casteism
positive,better start with ramdev and sri sri and asaram and others
positive,say ghanta this control your own party and ally first indiatoday intoday story narendra dabholkar murder maharashtra pass anti black magic bill number html
negative,now excuse while ask ganga bless
positive,meanwhile asaram successfully wipe out witness can prove not guilty bjp lawyers modi secret order
positive,how about rid the rich their superstitions and blind faith first maybe they will pay their tax instead dump wealth tirupati puttaparthi and so on
positive,who be dive way the future for perfect society and do gyan chodi hold your horse motherfucker one step time
negative,because only the poor be superstitious and have blind faith
positive,blind faith true most develop nations aren fanatical about religion
negative,twist modi secretly atheist use bjp rise power
positive,india really could well with little dose communism
neutral,vhp rss shouldn bother this
positive,suspect bjp may oppose this they have oppose before many state
negative,yes all superstitions and blind faith should replace clean brahminical hinduism espouse the vedas and write sanskrit
neutral,hear lot talk
positive,this guy become more and more like mao
negative,itt people worry modi talk hindi will mean will impose hindi the lingua franca for all india gujju ffs
positive,south indian who grow delhi entire life here the thing don understand the need for indians get snobbish about their languages when south indians need stay hindi speak state they have learn hindi for better communication with people and the same apply people from other state stay the south you gotta learn kannada you stay karnataka people win learn languages for you any place hate the english worship that go for reason always become attack hindi hate that don have unify language maybe like indonesia could have develop new language with elements from all languages around the country there deny language unify people its just not true india have too many languages and too many people who speak those languages the writer seem south indian his name all say that there nothing wrong modi speak hindi what wrong why should not speak hindi comfortable what with the love english english speak much lesser people than hindi the argument alienate people invalid there can multiple translators work translate what say one force any language down your throat either fact english have be much more force school where teachers force speak english college where see many bright people struggle only because they be be force things language they be not comfortable just say obviously they will have learn force language someone would say english be force much more than any other when want gift grandmother smartphone can why because languages like swahili and polish find place the settings but not hindi tamil telugu any other its collective failure that have raise english pedestal and kick our own languages the grind
positive,main ghanta waalon nahi sunne waala aap batao saath main unki batti gul karte hain modi putin and chinese premier now try say that english
neutral,those who use hindi their regional language their computers mobile please raise your hand not say use message email say entire system your regional language and not english
positive,great way close india off from the rest the world
positive,love english and use most the time but the same time also love indian languages try learn urdu script there shouldn language base bias society though person who know little english consider better than person who much intelligent and have rich vocabulary hindi word sad truth
negative,think there nothing wrong use vernacular language however there nothing specifically right about give the diversity within india and there nothing wrong but very practical with use english which have universal appeal both within india arguably not much among the illiterates and outside edit fix some typos
positive,perhaps islam and arabic would more appropriate
positive,other country use alien language medium for higher education example look china korea japan european countries and so on should know english well question this but need use native language primary communication medium ensure that mass be get expose scientific learn which hinder english the moment
negative,that terrible article say that language will help cultural reawaken slippery slope argument culture not something that static our culture have be evolve over the last century just have be over the last millennium mix and match with everything come across and this mix and match very much integral part any evolution say not do right and that should start over again just plain stupid can speak english and just indian the whole idea decolonisation just pander nationalistic sentiments and pick examples memes and expressions language say they not culturally relevant just rubbish the author have read the story ganesha ganesh chaturthi would have come across the expression elephant head like culturally lose use that phrase include the depiction attach the head onto body read any decent english literature wouldn feel squirmy inside the idea corpse nail cross can imagine where draw these examples and can cross finger anymore give fuck break miss the point completely culture form ideas and language simply mean for communicate these ideas when you get down the fundamentals all just the ideas that matter you can have the same culture yet speak different languages
neutral,yeah haamre saanscrewtee khilaugh hai
negative,what the fuck english have grow much beyond the itsy bitsy history that you associate with colonialism wake the fuck not you like live the numberth century each his own guess
positive,agree with this article but all languages come from sanskrit and sanskrit be bring iranians can speak the languages relate the oppressors also hindi influence from persian and many other oppressor languages think should only communicate sign language that the only way completely decolonize our mind although not communicate all would better which can also solve the biggest problem that hindus face the oppression different view but can afford but not the international sign language because develop west which oppress need develop our own sign language
neutral,
negative,its all begin modi evil plan make gujrati national language india
neutral,itt brown sepoys
positive,hope this decision also include plan have enough textbooks various subject least acceptable quality publish various indian languages until then good luck with this plan
negative,this bad
positive,oh my god stop support english this subreddit can have the mods wake and approve just the post hindi and other regional languages don need decolonize these mind why the hypocrisy
positive,just say seem easy say that have learn punjabi type keyboard for job and its mighty annoy
positive,one great advantage can crap all want hindi and claim be mistranslate later watch the bhutan speech dude give extempore there good chance could make mistake conversation but yeah translators can handle
positive,what catch eye be his point out the application the term sacred history semitic faiths and myth non semitic faiths include course hinduism amuse because sacred history deliciously creative euphemism for christian mythology concrete and real sound the word mythology have notice over time reserve anglophones for any non semitic stories greek norse hindu buddhist roman and so on whereas when come time describe their own mythology anglophones use scripture and never mythology but think sacred history even better imply there real history and then sacred history which true there history and then there myth and end thus with exceptions like amitabh ghosh the shadow line the entire corpus indo anglian literature leave little cold like make love through interpreter
positive,the biggest problem with hindi any regional language compare english that thry dont evolve live the computer age how many know the hindi any regional language word for computer the internet now compare this german arabic the moment something come out english be port these languages immediately never see that any indian languages
positive,speak language because you be comfortable one thing try enforce people who be not comfortable try reduce the influence language many find comfort the name decolonialisation just needle kulcha dick wave that say agree with some point this article the western bias against indian culture and the way approach something that quaint but primitive irritant but the author pedantic about many things rant about the economist and about how the vatican refer western predominantly christian crowd silly
positive,honestly think that that person live the south have absolutely need speak hindi when south indians the north people expect learn and speak hindi but when they come south they make attempt learn the language english common national language convenient because allow everybody converse easily
positive,great point srinivasan mother tongue isn hindi like all indians maybe and the plurality indians who aren hindi speakers should get rid hindi well while be do well the business decolonize ourselves
positive,modi think yar mujhe angrezi jyada ati nahi mai hindi bolunga firstpost brilliant plan modiji decolonize our colonial mindset bla bla bla
positive,further evidence that the age the unquestioned kowtow foreign tongue come end vive difference the french might say laugh out loud
negative,the fact that prime minister narendra modi have decide speak hindi with his foreign visitors clear statement principle there need apologise for indian ness nor there the need consider english the all and end all what bullshit be make such statement modi english shit and would embarrass for him struggle through interview and speeches make sense for him speak only hindi
negative,stop use windows native morons
neutral,cringe
neutral,not fakingnews my face when
negative,really wish india would require all pcs bundle with some sort antivirus every single time visit relatives take hours remove malware viruses and other crap
positive,surely raga one make laugh
neutral,not order photo its ribcs not brics
positive,huehuehue simply awesome
neutral,but didn understand shobha one
neutral,ganta hour work workaholic modi ever since take office have be jet
neutral,raga always such riot
neutral,don understand the ashutosh one brics be mistake actual bricks
positive,hilarious
positive,laugh out loud time now
positive,shit be awesome the ashutosh the huge ass sword all
positive,this interest
neutral,bang tharoor
neutral,how that the unrealtimes and the fakingnews guy be not reddit and india be they
