positive,family mormon have never try explain them they still stare puzzle from time time like some kind strange creature nonetheless they have come admire for the patience calmness equanimity acceptance and compassion have develop all the things buddhism teach
positive,buddhism have very much lot compatible with christianity especially consider that sin and suffer be almost the same thing suffer cause want things shouldn want go about get things the wrong way christian this would mean want things that don coincide with god will and want things that coincide but without the aid jesus buddhism could also see proof god all mighty will and omnipotence certainly christians be lucky have one such christ there side but what about everyone else well many christians believe god grace salvation and buddhism god way show grace upon others would also help study the things jesus say and see how buddha have make similar claim such rich man get into heaven joke basically advocate that should rid ourselves material possessions fact distinctly remember jesus make someone cry because that someone ask what achieve salvation and jesus reply with live like buddhist very very roughly translate also point out that buddha rarely speak anything about god theory personally because know well enough leave that jesus and mohamed who come later just remember conflict difference opinion but education can fun involve and enlighten easier teach something than prove right like intelligent design
negative,seriously don say thing first all they win get its too complex explain normal people anyway and they be dogmatic then doesn matter what you say see mechante post and for any reason you decide later life move from buddhism and that doesn suit you identity though you still get keep all the wisdom then your family will treat you like you go through weird hippy phase for while there didncha and you never hear the end pro tip don put one these your wall jpg
neutral,what you have learn yours and only yours what you want teach different focus the goal not the wrap paper buddhism can pass others without word about the buddha
positive,for your own benefit you may want read live buddha live christ thich nhat hanh you might find any subsequent discussions with your love ones easier you be able articulate some the parallel that exist between buddhism and christianity don surprise they react negatively for have lose you treat them with compassion and deserve understand although they may indeed display sign be hurt your new path properly share with them way that may alleviate their fear something they may perceive wrong the very least alien their beliefs may help allow them the long run accept although not necessarily agree with your decision regardless where they end you have make your own way
negative,you should all sit down together and watch the simpsons episode where lisa become buddhist simpsons season episode she little faith then discuss
positive,be teens when discover zen meditation be then undiagnosed bpd be homeschooled and just get numberk modem with web connection where come across link zen meditation try for couple weeks and the change be palpable felt the most profound sense peace ever felt grade immediately start go have more energy start martial arts just huge positive change all around parent ask something be wrong fundie parent when anything change this be where naivet kick foolishly tell them be try meditation and really calm down think they happy that find something that help but never forget what happen next mother affect this mockingly calm breathy voice she say you can pretend calm and happy all you want but without jesus you never content be that moment that any belief have christian faith all vanish completely realize that she have probably never be happy ever have never felt profoundly sorry for someone do for her that moment
neutral,jesus be zen meet jew
negative,there be two varieties christians dogmatic that dwell word and conservative that take heart the spirit the teach hate oversimplify things but help this understand you be discuss with dogmatic religious people who live the letter the law will uphill battle wish you luck you be discuss with moderate exchange idea should come fairly easily compare contrast also discuss parallel teach present differently wouldn out the ordinary they may give you relevant spiritual advice even though you be not believer their religion
positive,dont worry about try explain yourself just meditate regularly and try hard you can more aware everything else will follow come from someone who have be throught his situation welcome pms
positive,recently tell family that buddhist live the bible belt this whole ordeal involve leave the baptist church and everything be pretty rough but those who really care about have be open and accept they see the good have create life and relationships with others fact there be handful christians who have lovely conversations with and that truly respect someone else suggest live buddha live christ great one read about the important dialogue between buddhists and christians also welcome you message
positive,unto others you would have them unto you would good start
positive,first understand that you be not anyway control how they will react always find that any subject better understand first learn the vocabulary explain what the word buddha mean most people believe buddhists praise worship and follow guy name buddha christians due jesus let them know that one could both buddhist and christian with conflict the teach and the message jesus be indeed buddhist philosophy jesus become enlighten buddha and realize that have become annointed be christ then continue with your practice and let them work out their own issue that advice all the best
positive,recently hear similar question where person ask they should introduce meditation his love ones who have challenge cop with problems life the answer from the lama be quite interest instead give people advice one should focus his practice that way others will see the change and maybe even ask about personally think better keep yourself even though you must really excite about you can also keep dharma book around the house and sure people will pick them for quick browse when you be not look learn bite about other people traditions well browse through book they own
positive,different time different culture same point they be try get across jesus say god have begin nor end buddha say mind be never bear and have never die just replace the word meditation with prayer and couting the breath with the name jesus and everyone happy
negative,do evil include the lady pai chunk
positive,our campaign have two sun one pelor the other shamedan pelor the god all know and find bite stifle really shamedan the sun desert the burn sun who will kill you without mercy even second though shamedan bring drought and bring the fire that destroy all you own generally not very nice have race fey call desert hags who worship him and have radiant and fire resistance but they haven play nearly much part the campaign they should have
negative,technically you could argue that sobek evil would represent power and also crocodiles whereas also represent fertile land also the guy could shapeshift into crocodile badass
neutral,zarus
neutral,blood and souls for lord arioch
positive,always like vecna the one time be able use him story have blast play the fact that be far not the most powerful deity but be one the most dangerous due his portfolio but favorite pale night who technically not deity but close enough guess most the abyssal lord and the rulers the nine hells be fairly straightforward and have ample backstory but her lack thereof just intrigue
negative,though don have any good suggestions for additional deities the moment you should probably have some overlap the cavern dwell gnolls might consider pelor the god evil blind them with his wicked light loki have sufficiently fool them over the years into think their benefactor always lead them the bountiful crop they steal from the peasantry they have statues him fat woman give out food the starve they view the god death the god justice give righteous end those gnolls that have serve brutal conflict point view can change everything
negative,cliche but you can wrong with cyric mean be mortal who just nab all when get the chance you gotta respect that
positive,zon kuthon and his sister shelyn good deity have really cool story from the pathfinder set plus off topic pathfinder have the coolest good deity ever cayden cailean be bard that get waste one night stumble into the temple the star stone artifact that can turn you into deity and wake the next morning with hangover memory the night before and godly power
negative,homebrew set the primary lawful evil deity name for friend lewie essentially have three domains tyranny law apply without mercy vengeance and community the idea be that cruel and harsh god but also recognize that you catch more fly with honey than with vinegar thus his church often the most benevolent toward the common people day day basis the run gag that lewian church sponsor more inner city basketball team than any other major faith you probably want change the name but might make interest dynamic within your set
neutral,his name shall lump wherever lump be there warts tree burl breast humpback whale
negative,for one campaign pretty much just snatch the chaos god nurgle lord plague from the whfb whnumberk universe rename him narghull be nar ghull can remember random apostrophes be always nice though the campaign revolve around his cult try wake the god from sleep that have last number years but sadly stall very lazy this be back be never mean encounter directly mean never work out any stats anything basically work spread plague and other diseases and pretty damn evil think
negative,demogorgon because fuck you and your shit god
negative,you want badas elong evil gods you want real gods then choose from this list there plenty evil cthulhu mythos
negative,pelor the burn hate the best evil god
positive,for your information the traditional chtonic deity for magic for the romans least be the goddess hecate
negative,far evil go big fan shar from the forget realms set the god ultimate despair loss and suffer you know god evil when followers don even bother ask for small boons but instead invoke suffer themselves and others hop that those events will enough prevent the god from need get involve personally bring suffer into the world shar isn one those pansy goddesses evil where you might get nod appreciation for sacrifice with shar you better kill somebody damn near ever day and you get nothing and like with check out the dogma here
positive,like the idea prometheus give magic the pcs however think that prometheus should more like demi god and that the reason why give the magic mortals prometheus could jealous the fact that the gods have all the power and they grant him only half status upon his creation thus his revenge give humanity order turn the tide power among deities and mortals furthermore perhaps the repercussion prometheus feel from his action be drag the underworld cerberus make him seem less than deity like and more mortal inhuman order face judgment from egyptian goddess morals virtue and judge the dead
negative,pelor the burn hate also hextor boss god tyranny and conquest always fun think one the book there god lawyers too
positive,wee jas lawful neutral god death magic and necromancy not evil god but perfect representation the inevitable things which mortals fear while other evil gods make plan which may thwart wee jas merely wait all shall come her the end also play cleric her fabulous fun
positive,zen master bassui say when the function analytical consciousness destroy feel be purify this refer the pure land the west you truly want know the mean be bear the pure land you must first know the master who bear this land the physical body have never from its inception be the true body but rather temporary formation the five aggregate after the four elements disperse what remain call the self the self originally empty what that bear the pure land there master bear the pure land what that seek this land bliss just extinguish the ever seek mind rid thoughts and attachment form and the body consist the four elements will have individual self when there individual mind the nature mind and there aspect disorder
positive,pure land other power oppose the usual self power teach most buddhist school though the pure land here and now and not some other dimension the afterlife
positive,there be many flavour buddhism pure land ideas be not common all them however the important thing realize doesn really matter that the big difference compare the abrahamic religions buddhism not dogmatic the sense bunch things that must take literally else you be non believer sinner whatever maybe pure land ideas work for you great maybe they don great what work for you work for you what doesn work useless you the historical buddha himself teach dramatically different style suit his audience parables and metaphors be just that the point where they take you not literally believe them literally and physically true zen koans be good example this very purely distil most be the form stories but not stories you be believe physically happen you be read history book that entirely irrelevant what the story do you that the point you be wonder do this really happen do this place really exist you be miss that point also worth note that most things be about psychological phenomenon not physical phenomenon personally find this make buddhist cosmology much easier understand than consider competitor physical cosmology they not conflict they just about different cosmos
positive,go try comment this simply can get metaphysical and some may even say supernatural but hope you can try maintain open mind enough for help with your understand everything that physical everything that exist the universe and beyond be create the power the mind exercise through consciousness mara create the samsara worlds plan dimension that may experience joy sadness love heartbreaks and so on this be do through his her its focus the mind and stream consciousness begin attract these worlds plan dimension and begin develop crave for existence and thus begin the cycle rebirth the pure land buddhism be create the focus the mind amitabha buddha way help individuals attain enlightenment their own pace amitabha buddha understand that the attraction emotions sex love and existence can overwhelm for normal individuals overcome within one lifetime number years average for human be other be much shorter and yet others much longer create the pure land the west place refuge and practice for those who call upon his name sincerely this place not metaphorical state mind while these individuals be earth for lack better word real though not necessarily physical the way feel physical things via the electromagnetic repel force electrons this world certain laws physics be applicable that world land plane dimension whatchamacallit certain laws physics not apply and yet newer laws superphysics would also the rule there that not the law our world now have be carry this land doesn mean that the individuals be guarantee enlightenment first they still need cultivate themselves while there enlightenment not give dependant every single individual consciousness efforts shed the fetter samsara anger ignorance and jealousy and embrace the noble truths they may choose rejoin the samsaric worlds again and back into the cycle rebirth but least they have the option stay and cultivate themselves the pure land the west that would the main difference between the abrahamic idea heaven against the amitabha buddha pure land the west hope this help
positive,think your characterization pure land isn that far off there reason not that popular among westerners odd abandon christianity judaism and take pure land because first impressions buddhism be that be devoid dogma but now seem much leap faith the abrahamic religions least the pure land sect most form buddhism have some sort supernatural element some orthodox believers might deny that just like some christians might attempt make scientific arguments for the world be number years old the very least you have rebirth and different plan that include devas zen seem have the least reverence for dogma which why popular the west the other western strategy assume things be meaningful figuratively and not literally but yeah buddhism religion the end the day for most its followers
positive,most religions have dogmatic orthodox well esoteric philosophic side the christian heaven can see palace the cloud state mind rebirth buddhism can see fact just superstition leave over from other beliefs you interpret and understand you see fit like think about various religions talk about the same thing use different word and yes cherry pick what believe but honestly and very carefully think better than take everything religion say and reject everything doesn say there must hundred different ways talk about enlightenment heaven pure land individuation alchemy rites passage education trials meditation the tricky part that what describe can easily explain word and most importantly have understand which different than just know read about the pure land real place state mind doubt real place but sure some will believe buddhism have some dogma but not nearly much eastern religions
positive,you win find one answer your question but the pure land state mind perspective reality not separate place let quote thich nhat hanh human be our deepest desire find environment which secure and where there love and understand all want live such environment you live surround where you feel there security understand and love and where people have the capacity transform their suffer fear and attachment then you live the pure land from find our true home this isn leap faith all because you have already be the pure land but momentarily every time you bring the buddha mind fully then you be say the pure land imagine because you enter that state some degree this not matter faith but expand upon what you know joyful experience quite different the abrahamic religions concept heaven which eschatological reality rather than gnostic one will add that there course be some who believe the pure land totally separate paradise however there be positive ways understand this when the state mind another rebirth will seem like such foreign reality that may well different place entirely
positive,first impressions buddhism be that be devoid dogma isn good thing about buddhism least for outsider that much easier pick and choose what part you not want use see dogma kind environment habitat for the profound and useful ideas develop all religions have something useful buddhist religions and not just one homogeneous buddhism just seem have something that more relevant and powerful the context our culture
positive,from limit knowledge the pure land not paradise but place contemplation step off point where you be give the knowledge leave the cycle suffer and rebirth anything more akin the now defunct catholic idea purgatory than actual heaven
positive,response your question about how amitabha create the pure land this quote from the article pure land buddhism wikipedia the longer sukhvatvyha stra the buddha begin describe his attendant nanda past life the buddha amitbha state that past life amitbha be once king who renounce his kingdom and become bodhisattva monk name dharmkara dharma storehouse under the guidance the buddha lokevararja world sovereign king innumerable buddha land throughout the ten directions be reveal him after meditate for five eons bodhisattva then make great series vow save all sentient be and through his great merit create the realm sukhvat ultimate bliss this land sukhvat would later come know the pure land chinese translation important remember that buddhism have be around for thousands years and that for long time buddhists didn have telescope big machine scan the brain with his holiness the dalai lama himself have say that the discoveries science and the teach buddhism contradict then the discoveries science be correct this video tgvnumbergwvrz one the major teach the buddha be test out each his teach oneself order see they be true rather than take his word faith without proof however course just man who have see mountain some remote region where one have not travel may believe until the distance that region cross might have some sort faith buddhist teach since the people do the teach have often devote their whole live the teach the buddha
positive,exactly the song be jam when make this
neutral,nam indeed
neutral,jbdbxnumberpxga
neutral,maybe they eat dosa who know
negative,accord this national broadcast company chicago article walsh hold ladies week number html here what they have say about joe walsh unless you conservative suburban white male over rep joe walsh tea party ill have say something offend you walsh rhetoric have be caricature the image republicans party devote only old white guy
negative,be you guy seriously piss about idli sambar remark think be past all this second thoughts one give shit about the tea party not even the their craziness get too much even for the hardcore republicans
negative,tea partier express support for namo after eat idli sambar with conservative indian american group indiatribune com submit minutes ago ladki realize you hate modi but you just show off your casual racism with that idli sambhar snide remark another think fuck off
positive,the discussion about the rat end conclude win work because you will naturally headbutt the rat death minotaur might work with another race though trog wrath very very very difficult survive you have boot levitation and lot food you might able hover over lava deep water win help summon giant size creatures other than that tomb card might work you have your stash food not sure you not use shield you might well switch two hand axe from experience anti magic isn that great with brand fire you can generally kill things faster use holy versus liches and other undead casters and also kill them faster
negative,could swear they lower trog wrath just get extremely lucky because recently try make the switch kobe and be not difficult all just take food ring and some perma food and carve out two space area near the the summon be actually not the worst part the worst get be berserk hill giant and the vast majority be just berserk bear for the worst part be actually the rot since happen least time and never catch right away while spamming rest
positive,for the love gods don the aby until trog wrath over none your teleport blink panic button work lose handful very promise mibes this way
positive,when and how suppose swap tso and branch order from there basically you switch immediately before enter crypt clear crypt max tso piety then holy brand your best weapon your case that executioners axe and off you post endgame branch order like whatever theres strict order like there the early game whichever branch you feel best prepare for how avoid meet terrible fate the hand trog wrath you have book with blink soon you leave trog train transloc little bite that you can cast then whenever surround you with berserking enemies you can blink out the middle them and run staircase teleport you can keep scroll blink hand for this purpose but feel more secure also have the spell trog wrath include fire miscast that burn all your shit see trick with go lair and have rat block you off but this still viable you can the rat shield thing with most combos but its tedious and unnecessary and your case the minotaur retaliatory headbutt would kill the rat anyway its not option antimagic axe that carry around viable for use all since strictly one hand should train shield use with since have shield reflection could use not really war ax arent very good and while have fantastic selection resist do little damage that its not practical choice weapon against any tough monster wouldnt forgo the damage output weapon use physical shield shield arent very good for melee allruners and therse always tsos divine shield ability you want reflection isnt good shield brand plus its double not good for tso worshiper you reflect poison projectile and hit something you will incur penance for use poison
positive,brother trog very wrathful indeed but his will destroy you neither endless nor inevitable go take the route many will find the easy way out and say that get past trog your level trivial his wrath dangerous out the open but when you be able choose the area dilute mere timesink what you must grab your closest disintegration wand and cut two diagnols into the wall this will allow you only view one other tile time this point you simply need make sure you have good chunk permafood pip two and then either drop your scroll wear conservation that point you just spam rest and then tab every time trog have tantrum minotaur your power should have trouble kill his summon after long while you will get message say have calm down then you be free worship that damn tso trog wrath your level probably one the least dangerous things you can spend your time deal with you be will cheese
positive,be you slime zot except for the orb chamber and blade hopefully you find some better armour you really want good executioner axe before you convert well the okay but could better you really need wear plate gda something heavier you have more than abandon trog with level mibe and find pretty trivial the berserked stone giants weren terribly difficult and clear tomb and most all hells while under trog wrath but somewhat wary try this with your low and weak weapon you could try wait out but take thousands and thousands turn very bore one hand ax suck use executioner axe
